{
  "$schema": "../../schema-json/activity.schema.json",
  "id": "activity.baking",
  "label": "baking",
  "waitingLabel": "baking",
  "interest": "cooking",
  "venue": [
    {
      "machineTag": "stove"
    }
  ],
  "participants": {
    "min": 1,
    "max": 1
  },
  "durationDays": 0.05,
  "restores": {
    "recreation": 0.35
  },
  "outcome": "none",
  "blockedByProblems": ["mealToCook"],
  "produces": {
    "itemDefId": "item.treat",
    "count": 4,
    "zoneTag": "serving"
  }
}
