{
  "$schema": "../../schema-json/activity.schema.json",
  "id": "activity.stargazing",
  "label": "stargazing",
  "waitingLabel": "watching the stars",
  "interest": "stargazing",
  "venue": [
    {
      "zoneTag": "viewport"
    }
  ],
  "participants": {
    "min": 1,
    "max": 2
  },
  "durationDays": 0.06,
  "restores": {
    "recreation": 0.35,
    "comfort": 0.1
  },
  "outcome": "bond",
  "thoughts": {
    "joined": "goodCompany"
  },
  "memories": {
    "together": "goodTime"
  },
  "transitOnly": true
}
