{
  "$schema": "../../schema-json/activity.schema.json",
  "id": "activity.music",
  "label": "playing the harmonica",
  "waitingLabel": "tuning up",
  "interest": "music",
  "venue": [
    {
      "compartmentTag": "lounge"
    },
    {
      "compartmentTag": "mess"
    }
  ],
  "participants": {
    "min": 1,
    "max": 1
  },
  "durationDays": 0.05,
  "restores": {
    "recreation": 0.4
  },
  "outcome": "perform",
  "thoughts": {
    "listened": "enjoyedMusic",
    "listenedDislike": "hatedTheNoise"
  },
  "requires": {
    "itemTag": "instrument",
    "own": true
  }
}
