{
  "$schema": "../../schema-json/activity.schema.json",
  "id": "activity.tinkering",
  "label": "tinkering",
  "waitingLabel": "tinkering",
  "interest": "tinkering",
  "venue": [
    {
      "machineTag": "workbench"
    }
  ],
  "participants": {
    "min": 1,
    "max": 1
  },
  "durationDays": 0.1,
  "restores": {
    "recreation": 0.35
  },
  "outcome": "none",
  "skillGain": {
    "skill": "engineering",
    "perDay": 0.2
  }
}
